{"attempt":{"attempt_limit":1,"failure_preservation":"additive-no-retry","network_allowed":false,"pseudo_holdout_case_count":10,"real_corpus_allowed":false,"real_repository_allowed":false,"synthetic_only":true},"candidate":{"package_version":"0.4.0-rc.1","production_artifact_sha256":"0f87af4dfd851c268891c96237accf20b5089b0e0b95e10ac1417efebcca83a9","production_change_allowed":false,"runtime_dependency_count":0},"conclusions":{"allowed":["simulation-complete","simulation-failed","simulation-inconclusive","simulation-invalid"],"release_supported_allowed":false},"design":{"category_count":5,"development_cases_per_category":2,"development_total":10,"prospective_sample_requirement_satisfied":false,"pseudo_holdout_cases_per_category":2,"pseudo_holdout_total":10,"purpose":"mechanical-rehearsal-only"},"evidence_classification":"simulated-development-only","human_independence":false,"namespace":"eval/v1.0.0-simulation","ordering":["bind-protocols-specification-and-implementation","declare-six-simulated-personas","freeze-population-and-contamination-registry","commit-and-reveal-sim-ce-and-sim-ro-entropy","deterministically-select-development-and-pseudo-holdout","freeze-labeling-rubric","finalize-raw-labels-a","finalize-raw-labels-b-without-a-access","measure-simulated-agreement","adjudicate-without-predictions","freeze-final-simulated-labels","freeze-unchanged-baseline-candidate","durably-consume-exactly-one-pseudo-attempt","process-ten-pseudo-holdout-fixtures-once","finalize-predictions-traces-comparison-and-gates","unblind-simulated-predictions","apply-simulation-gates-mechanically","produce-one-permitted-simulation-conclusion"],"persona_ids":["SIM-CO","SIM-CE","SIM-LA","SIM-LB","SIM-ADJ","SIM-RO"],"prospective_protocol_activated":false,"release_authority":false,"schema":"kanon-v1.0.0-synthetic-governance-tabletop-protocol-v1","simulation":true,"status":"frozen-simulation-only","version":1}
